{
  "$schema": "https://json-schema.org/draft/2020-12/schema",
  "$id": "https://example.com/resume.schema.json",
  "type": "object",
  "properties": {
    "profile": {
      "type": "object",
      "required": [
        "name",
        "title"
      ],
      "properties": {
        "name": {
          "type": "string",
          "minLength": 1
        },
        "title": {
          "type": "string"
        },
        "summary": {
          "type": "string"
        },
        "location": {
          "type": "string"
        },
        "email": {
          "type": "string"
        },
        "website": {
          "type": "string"
        },
        "pgp": {
          "type": "string"
        },
        "links": {
          "type": "object",
          "properties": {
            "github": {
              "type": "string"
            },
            "linkedin": {
              "type": "string"
            }
          },
          "additionalProperties": true
        }
      },
      "additionalProperties": false
    },
    "skills": {
      "type": "object",
      "properties": {
        "categories": {
          "type": "array",
          "items": {
            "type": "object",
            "properties": {
              "name": {
                "type": "string"
              },
              "items": {
                "type": "array",
                "items": {
                  "type": "string"
                }
              }
            },
            "required": [
              "name",
              "items"
            ],
            "additionalProperties": false
          }
        }
      },
      "additionalProperties": false
    },
    "experience": {
      "type": "array",
      "items": {
        "type": "object",
        "properties": {
          "org": {
            "type": "string"
          },
          "role": {
            "type": "string"
          },
          "start": {
            "type": [
              "string",
              "null"
            ]
          },
          "end": {
            "type": [
              "string",
              "null"
            ]
          },
          "summary": {
            "type": "string"
          },
          "highlights": {
            "type": "array",
            "items": {
              "type": "string"
            }
          }
        },
        "required": [
          "org",
          "role",
          "start"
        ],
        "additionalProperties": false
      }
    },
    "projects": {
      "type": "array",
      "items": {
        "type": "object",
        "properties": {
          "title": {
            "type": "string"
          },
          "description": {
            "type": "string"
          },
          "role": {
            "type": "string"
          },
          "year": {
            "type": [
              "integer",
              "string"
            ]
          },
          "url": {
            "type": [
              "string",
              "null"
            ]
          },
          "repo": {
            "type": [
              "string",
              "null"
            ]
          },
          "tags": {
            "type": "array",
            "items": {
              "type": "string"
            }
          }
        },
        "required": [
          "title"
        ],
        "additionalProperties": false
      }
    },
    "certifications": {
      "type": "array",
      "items": {
        "type": "object",
        "properties": {
          "name": {
            "type": "string"
          },
          "issuer": {
            "type": "string"
          },
          "year": {
            "type": [
              "integer",
              "string"
            ]
          }
        },
        "required": [
          "name",
          "issuer"
        ]
      }
    },
    "education": {
      "type": "array",
      "items": {
        "type": "object",
        "properties": {
          "school": {
            "type": "string"
          },
          "degree": {
            "type": "string"
          },
          "year": {
            "type": [
              "integer",
              "string"
            ]
          }
        },
        "required": [
          "school",
          "degree"
        ]
      }
    },
    "talks": {
      "type": "array",
      "items": {
        "type": "object",
        "properties": {
          "title": {
            "type": "string"
          },
          "event": {
            "type": "string"
          },
          "year": {
            "type": [
              "integer",
              "string"
            ]
          },
          "url": {
            "type": [
              "string",
              "null"
            ]
          }
        },
        "required": [
          "title"
        ]
      }
    }
  },
  "required": [
    "profile"
  ],
  "additionalProperties": false
}